{
  "$schema": "https://json-schema.org/draft/2020-12/schema",
  "$id": "https://registry.lang.bio/schemas/registry-entry-v1.schema.json",
  "title": "BioLang registry entry v1",
  "type": "object",
  "additionalProperties": false,
  "required": ["schema", "kind", "id", "name", "title", "summary", "publisher", "version", "status", "verified", "manifest", "manifestSha256", "publishedAt", "compatibility", "categories", "tags", "sourceRepository", "licence", "validation"],
  "properties": {
    "schema": {"const": 1},
    "kind": {"enum": ["lesson", "package", "workflow", "tool", "dataset", "provider"]},
    "id": {"type": "string", "pattern": "^[a-z0-9][a-z0-9._-]*/[a-z0-9][a-z0-9._-]*$"},
    "name": {"type": "string", "pattern": "^[a-z0-9][a-z0-9._-]*$"},
    "title": {"type": "string", "minLength": 1},
    "summary": {"type": "string", "minLength": 1},
    "publisher": {"type": "string", "pattern": "^[a-z0-9][a-z0-9._-]*$"},
    "version": {"type": "string", "pattern": "^\\d+\\.\\d+\\.\\d+(?:-[0-9A-Za-z.-]+)?$"},
    "status": {"enum": ["preview", "stable", "deprecated", "withdrawn"]},
    "verified": {"type": "boolean"},
    "manifest": {"type": "string", "format": "uri", "pattern": "^https://"},
    "manifestSha256": {"type": "string", "pattern": "^[a-f0-9]{64}$"},
    "publishedAt": {"type": "string", "format": "date"},
    "compatibility": {
      "type": "object",
      "additionalProperties": false,
      "required": ["biolang", "studio", "runtimes"],
      "properties": {
        "biolang": {"type": "string"},
        "studio": {"type": "string"},
        "runtimes": {"type": "array", "items": {"enum": ["browser", "desktop", "somer", "cli"]}, "uniqueItems": true, "minItems": 1}
      }
    },
    "categories": {"type": "array", "items": {"type": "string", "pattern": "^[a-z0-9][a-z0-9-]*$"}, "uniqueItems": true, "minItems": 1},
    "tags": {"type": "array", "items": {"type": "string"}, "uniqueItems": true},
    "discoverability": {
      "type": "object",
      "additionalProperties": false,
      "required": ["problems", "methods", "plots", "terms", "aliases", "functions"],
      "properties": {
        "problems": {"$ref": "#/$defs/requiredSearchTerms"},
        "methods": {"$ref": "#/$defs/requiredSearchTerms"},
        "plots": {"$ref": "#/$defs/searchTerms"},
        "terms": {"$ref": "#/$defs/requiredSearchTerms"},
        "aliases": {"$ref": "#/$defs/requiredSearchTerms"},
        "functions": {"$ref": "#/$defs/searchTerms"}
      }
    },
    "sourceRepository": {"type": "string", "format": "uri", "pattern": "^https://"},
    "licence": {"type": "string", "minLength": 1},
    "validation": {"type": "string", "minLength": 1},
    "series": {
      "type": "object",
      "additionalProperties": false,
      "required": ["id", "title", "url", "order", "chapter"],
      "properties": {
        "id": {"type": "string", "pattern": "^[a-z0-9][a-z0-9._-]*$"},
        "title": {"type": "string", "minLength": 1},
        "url": {"type": "string", "format": "uri", "pattern": "^https://"},
        "order": {"type": "integer", "minimum": 0},
        "chapter": {"type": "string", "minLength": 1}
      }
    },
    "dataset": {
      "type": "object",
      "additionalProperties": false,
      "required": ["provider", "access", "formats", "modalities", "organisms", "fileCount", "totalBytes"],
      "properties": {
        "provider": {"type": "string", "pattern": "^[a-z0-9][a-z0-9._-]*/[a-z0-9][a-z0-9._-]*$"},
        "access": {"enum": ["public", "registration", "controlled"]},
        "formats": {"type": "array", "items": {"type": "string"}, "uniqueItems": true, "minItems": 1},
        "modalities": {"type": "array", "items": {"type": "string"}, "uniqueItems": true},
        "organisms": {"type": "array", "items": {"type": "string"}, "uniqueItems": true},
        "fileCount": {"type": "integer", "minimum": 1},
        "totalBytes": {"type": "integer", "minimum": 1}
      }
    },
    "provider": {
      "type": "object",
      "additionalProperties": false,
      "required": ["adapter", "authentication", "capabilities", "apiDocumentation"],
      "properties": {
        "adapter": {"type": "string"},
        "authentication": {"enum": ["none", "api-key", "oauth", "controlled"]},
        "capabilities": {"type": "array", "items": {"enum": ["search", "resolve", "download", "range", "metadata"]}, "uniqueItems": true, "minItems": 1},
        "apiDocumentation": {"type": "string", "format": "uri", "pattern": "^https://"}
      }
    }
  },
  "allOf": [
    {"if": {"properties": {"kind": {"const": "lesson"}}}, "then": {"required": ["discoverability"]}},
    {"if": {"properties": {"kind": {"const": "dataset"}}}, "then": {"required": ["dataset"]}},
    {"if": {"properties": {"kind": {"const": "provider"}}}, "then": {"required": ["provider"]}},
    {"if": {"required": ["series"]}, "then": {"properties": {"kind": {"const": "lesson"}}}}
  ],
  "$defs": {
    "searchTerms": {
      "type": "array",
      "items": {"type": "string", "minLength": 2, "pattern": "^\\S(?:.*\\S)?$"},
      "uniqueItems": true
    },
    "requiredSearchTerms": {
      "allOf": [{"$ref": "#/$defs/searchTerms"}, {"minItems": 1}]
    }
  }
}
