{
  "schema": 1,
  "kind": "lesson",
  "id": "oriclabs/rmrwr-blood-storage-columns",
  "name": "rmrwr-blood-storage-columns",
  "title": "Reproducible Medical Research with R: Blood-Storage Columns",
  "summary": "A one-to-one non-contiguous column-selection example using the exact de-identified 316-patient blood-storage cohort.",
  "publisher": "oriclabs",
  "version": "1.0.0",
  "status": "stable",
  "verified": false,
  "manifest": "https://raw.githubusercontent.com/oriclabs/biolang-lessons/main/lessons/biostatistics/rmrwr-blood-storage-columns/lesson.json",
  "manifestSha256": "b42f2eb46cc5781772b89c7702c50d2dec5a7276c6db5324d0ed992cdc1352bd",
  "publishedAt": "2026-09-03",
  "compatibility": {
    "biolang": ">=1.5.0",
    "studio": ">=0.1.0",
    "runtimes": [
      "browser",
      "desktop",
      "somer"
    ]
  },
  "categories": [
    "clinical-research",
    "biostatistics",
    "data-analysis",
    "teaching"
  ],
  "tags": [
    "clinical research",
    "data wrangling",
    "cohort",
    "CC0"
  ],
  "discoverability": {
    "problems": [
      "select non-contiguous clinical variables",
      "reorder a clinical table",
      "inspect a de-identified prostate-cancer cohort"
    ],
    "methods": [
      "column selection",
      "column range expansion",
      "clinical data inspection"
    ],
    "plots": [],
    "terms": [
      "blood storage",
      "prostate cancer",
      "retrospective cohort",
      "Gleason score",
      "PSA",
      "column selection"
    ],
    "aliases": [
      "RMRWR selecting columns",
      "medicaldata blood_storage",
      "prostate cohort columns"
    ],
    "functions": [
      "read_csv",
      "select",
      "head",
      "colnames",
      "nrow"
    ]
  },
  "sourceRepository": "https://github.com/oriclabs/biolang-lessons",
  "licence": "CC0-1.0; data package MIT",
  "validation": "Exact 316x20 medicaldata object and exact ten-column source order with first rows reproduced",
  "series": {
    "id": "reproducible-medical-research-with-r",
    "title": "Reproducible Medical Research with R",
    "url": "https://peter-higgins-rmrwr.share.connect.posit.cloud/",
    "order": 5,
    "chapter": "Selecting Columns - non-contiguous blood-storage example"
  }
}
