{
  "schema": 1,
  "kind": "lesson",
  "id": "oriclabs/bdsr-rnaseq",
  "name": "bdsr-rnaseq",
  "title": "Count-based differential expression analysis of RNA-seq data",
  "summary": "A source-faithful BDSR Chapter 12 port using exact real airway data, all fourteen exercises, independently regenerated historical DESeq2 results, and every analytical plot generated by BioLang.",
  "publisher": "oriclabs",
  "version": "1.0.0",
  "status": "stable",
  "verified": false,
  "manifest": "https://raw.githubusercontent.com/oriclabs/biolang-lessons/main/lessons/transcriptomics/bdsr-rnaseq/lesson.json",
  "manifestSha256": "228cff180e126a00b75c841b2ed419a43274d572263450603f864e3df5300412",
  "publishedAt": "2026-09-05",
  "compatibility": {
    "biolang": ">=1.5.0",
    "studio": ">=0.1.0",
    "runtimes": [
      "browser",
      "desktop",
      "somer"
    ]
  },
  "categories": [
    "transcriptomics",
    "statistics",
    "teaching",
    "validation"
  ],
  "tags": [
    "RNA-seq",
    "DESeq2",
    "differential expression",
    "PCA",
    "heatmap",
    "pathway analysis",
    "airway"
  ],
  "discoverability": {
    "problems": [
      "find genes changed by a treatment",
      "compare replicated RNA-seq conditions",
      "normalise unequal sequencing depth",
      "control false discoveries across thousands of genes",
      "inspect RNA-seq sample structure and outliers",
      "prepare ranked genes for pathway analysis"
    ],
    "methods": [
      "negative binomial model",
      "DESeq2",
      "median-of-ratios size factors",
      "dispersion estimation",
      "Wald test",
      "Benjamini-Hochberg adjustment",
      "independent filtering",
      "variance stabilising transformation",
      "principal component analysis",
      "Pearson hierarchical clustering"
    ],
    "plots": [
      "RNA-seq mean-count scatter plot",
      "log-log scatter plot",
      "box plot",
      "MA plot",
      "volcano plot",
      "PCA plot",
      "clustered heatmap",
      "dendrogram"
    ],
    "terms": [
      "RNA-seq",
      "count matrix",
      "sample metadata",
      "dexamethasone",
      "airway",
      "Ensembl gene ID",
      "gene annotation",
      "log2 fold change",
      "baseMean",
      "adjusted p-value",
      "false discovery rate",
      "VST",
      "CRISPLD2",
      "over-representation analysis",
      "ranked enrichment",
      "pathway analysis"
    ],
    "aliases": [
      "differential gene expression",
      "DGE",
      "differential expression",
      "DE analysis",
      "RNA sequencing",
      "DEG analysis",
      "gene expression workflow"
    ],
    "functions": [
      "read_csv",
      "table",
      "filter",
      "arrange",
      "inner_join",
      "select",
      "stats_relationship_plot",
      "stats_group_plot",
      "pca_plot",
      "clustered_heatmap"
    ]
  },
  "sourceRepository": "https://github.com/oriclabs/biolang-lessons",
  "licence": "CC BY-NC 4.0; airway data LGPL; annotation GPL-3",
  "validation": "Exact real airway inputs; R 4.5.2 and historical DESeq2 1.44.0 numeric oracle; 14/14 exercises; full BioLang notebook and analytical-plot contract rerun",
  "series": {
    "id": "biological-data-science-with-r",
    "title": "Biological Data Science with R",
    "url": "https://bdsr.stephenturner.us/",
    "order": 12,
    "chapter": "Chapter 12 - Count-based differential expression analysis of RNA-seq data"
  }
}
