{
  "schema": 1,
  "kind": "lesson",
  "id": "oriclabs/bdsr-survival-analysis",
  "name": "bdsr-survival-analysis",
  "title": "Survival analysis with lung, colon, and TCGA data",
  "summary": "A validated BioLang lesson covering the complete BDSR survival chapter, all 13 exercises and figures, Kaplan-Meier and Cox methods, TCGA expression, pan-kidney analysis, and the closing resource guide.",
  "publisher": "oriclabs",
  "version": "0.1.0",
  "status": "stable",
  "verified": false,
  "manifest": "https://raw.githubusercontent.com/oriclabs/biolang-lessons/main/lessons/biostatistics/bdsr-survival/lesson.json",
  "manifestSha256": "2adcc7f7a077ad8d9790d535c7853a99d926d3511c43e4c326c0735673f58be1",
  "publishedAt": "2026-09-02",
  "compatibility": {
    "biolang": ">=1.5.0",
    "studio": ">=0.1.0",
    "runtimes": ["browser", "desktop", "somer"]
  },
  "categories": ["statistics", "teaching"],
  "tags": ["survival", "Kaplan-Meier", "log-rank", "Cox regression", "TCGA", "kidney", "clinical", "exercises"],
  "discoverability": {
    "problems": ["analyse time until death or recurrence", "handle censored follow-up data", "estimate survival over time", "compare survival between patient groups", "estimate an adjusted hazard ratio", "assess treatment and prognostic factors", "relate gene expression to patient survival"],
    "methods": ["Kaplan-Meier estimator", "life table", "log-rank test", "Cox proportional hazards regression", "multivariable Cox model", "risk set estimation", "survival stratification"],
    "plots": ["survival curve", "Kaplan-Meier plot", "risk table", "censoring marks", "hazard ratio forest plot", "histogram", "box plot", "violin plot", "faceted gene expression plot"],
    "terms": ["right censoring", "event time", "follow-up time", "median survival", "hazard", "hazard ratio", "proportional hazards", "confidence interval", "number at risk", "recurrence-free survival", "overall survival", "clinical covariate", "TCGA", "RTCGA", "pan-kidney cohort", "TCGAbiolinks", "cBioPortal", "OncoLnc", "TANRIC", "MEXPRESS"],
    "aliases": ["time-to-event analysis", "KM curve", "survival probability", "log rank test", "Cox model", "Cox PH", "relative hazard", "censored observations", "patient outcome analysis"],
    "functions": ["kaplan_meier", "log_rank_test", "stats_cox_diagnostics", "forest_plot", "histogram", "stats_group_plot", "violin_plot", "plot_grid", "cross_tab", "inner_join", "read_csv"]
  },
  "sourceRepository": "https://github.com/oriclabs/biolang-lessons",
  "licence": "MIT",
  "validation": "R 4.5.2 survival 3.8-3 and RTCGA content-owned oracle",
  "series": {
    "id": "biological-data-science-with-r",
    "title": "Biological Data Science with R",
    "url": "https://bdsr.stephenturner.us/",
    "order": 9,
    "chapter": "Chapter 9 · Survival analysis"
  }
}
