{
  "schema": 1,
  "kind": "lesson",
  "id": "oriclabs/stats4nr-fishing-dispersion",
  "name": "stats4nr-fishing-dispersion",
  "title": "Statistics in Natural Resources: Fishing-Count Dispersion",
  "summary": "A one-to-one port of the fishing-count distribution check using exact package data, published summary values, and the byte-for-byte source histogram.",
  "publisher": "oriclabs",
  "version": "1.0.0",
  "status": "withdrawn",
  "verified": false,
  "manifest": "https://raw.githubusercontent.com/oriclabs/biolang-lessons/main/lessons/ecology/stats4nr-fishing-dispersion/lesson.json",
  "manifestSha256": "1ede647d0980e7991679fc349ff20e9eafb8e751f43bb6728a7666f23d3599c4",
  "publishedAt": "2026-09-03",
  "compatibility": {"biolang": ">=1.5.0", "studio": ">=0.1.0", "runtimes": ["browser", "desktop", "somer"]},
  "categories": ["ecology", "statistics", "teaching"],
  "tags": ["ecology", "count data", "overdispersion", "CC BY-NC-SA"],
  "discoverability": {
    "problems": ["diagnose overdispersion in wildlife count data", "measure excess zeros in fishing catches", "inspect a count response before regression"],
    "methods": ["mean-variance comparison", "zero-frequency analysis", "count-data exploratory analysis"],
    "plots": ["fish-catch histogram"],
    "terms": ["count data", "overdispersion", "zero inflation", "Poisson assumption", "fishing success", "variance-to-mean ratio"],
    "aliases": ["Stats4NR fishing case study", "fishing count dispersion", "natural resources count data"],
    "functions": ["read_csv", "mean", "variance", "filter", "nrow"]
  },
  "sourceRepository": "https://github.com/oriclabs/biolang-lessons",
  "licence": "CC BY-NC-SA 4.0; package data CC0",
  "validation": "Exact official 250-row fishing object and byte-for-byte source histogram; mean 3.296, sample variance 135.373879518072, and 56.8% zero catches reproduced",
  "series": {"id": "statistics-in-natural-resources", "title": "Statistics in Natural Resources: Applications with R", "url": "https://stats4nr.com/", "order": 13, "chapter": "Chapter 13 - Fishing count distribution and dispersion"}
}
