{
  "schema": 1,
  "kind": "lesson",
  "id": "oriclabs/bdsr-essential-statistics-extended",
  "name": "bdsr-essential-statistics-extended",
  "title": "Biological Data Science with R: Essential Statistics 8.3.2-8.7",
  "summary": "Five connected source-faithful notebooks restore the Wilcoxon, regression, categorical-data, power, model-tidying, and closing study-design sequence, including Understanding panels and BioLang-generated figures.",
  "publisher": "oriclabs",
  "version": "1.1.1",
  "status": "stable",
  "verified": false,
  "manifest": "https://raw.githubusercontent.com/oriclabs/biolang-lessons/main/lessons/biostatistics/bdsr-essential-statistics-extended/lesson.json",
  "manifestSha256": "bbfa7a459404a11b726cbeb45f398522593a48da46ffa16e441419ca6d978004",
  "publishedAt": "2026-09-05",
  "compatibility": {
    "biolang": ">=1.5.0",
    "studio": ">=0.1.0",
    "runtimes": [
      "browser",
      "desktop",
      "somer"
    ]
  },
  "categories": [
    "biostatistics",
    "epidemiology",
    "teaching",
    "visualization"
  ],
  "tags": [
    "biostatistics",
    "NHANES",
    "regression",
    "power",
    "CC BY-NC"
  ],
  "discoverability": {
    "problems": [
      "compare skewed alcohol-use observations",
      "show equivalence of two-group mean models",
      "adjust testosterone associations for age and gender",
      "test association between gender and diabetes",
      "model insurance status from race age and income",
      "calculate statistical power",
      "plan sample size for gene expression and GWAS",
      "extract reusable model results",
      "inspect residuals from a multiple regression",
      "distinguish biological sample size from technical measurements"
    ],
    "methods": [
      "Wilcoxon rank-sum test",
      "equal-variance t-test",
      "two-group ANOVA",
      "indicator linear regression",
      "multiple linear regression",
      "nested model interpretation",
      "contingency table",
      "chi-square independence test",
      "Fisher exact test",
      "logistic regression",
      "two-sample t-test power",
      "two-proportion power",
      "sample-size calculation",
      "tidy coefficient extraction",
      "model augmentation",
      "model-level summary"
    ],
    "plots": [
      "AlcoholYear histogram",
      "gender diabetes mosaic plot",
      "race insurance mosaic plot",
      "residuals versus fitted plot"
    ],
    "terms": [
      "NHANES",
      "nonparametric test",
      "rank sum",
      "dummy variable",
      "confounding",
      "adjusted association",
      "coefficient",
      "R squared",
      "categorical outcome",
      "row proportion",
      "expected count",
      "log odds",
      "White reference level",
      "effect size",
      "statistical power",
      "significance level",
      "samples per group",
      "fitted value",
      "residual",
      "coefficient table",
      "model diagnostics",
      "batch effect",
      "biological replicate",
      "technical replicate"
    ],
    "aliases": [
      "Mann-Whitney U test",
      "BDSR Wilcoxon",
      "two group linear model",
      "BDSR multiple regression",
      "testosterone model",
      "BDSR categorical data",
      "insurance GLM",
      "mosaicplot",
      "BDSR power analysis",
      "power.t.test",
      "power.prop.test",
      "BDSR broom",
      "tidy augment glance",
      "residual plot"
    ],
    "functions": [
      "read_csv",
      "filter",
      "drop_null",
      "histogram",
      "wilcoxon",
      "ttest",
      "anova",
      "lm",
      "stats_multiple_linear_diagnostics",
      "cross_tab",
      "chi_square_contingency",
      "fisher_exact",
      "mosaic_plot",
      "mutate",
      "arrange",
      "stats_glm_diagnostics",
      "power_t_test",
      "power_prop_test",
      "table",
      "stats_relationship_plot"
    ]
  },
  "sourceRepository": "https://github.com/oriclabs/biolang-lessons",
  "licence": "CC BY-NC 4.0",
  "validation": "Exact source-hosted NHANES calculations, White-reference logistic models, R-default power convention, and four BioLang runtime figures; both mosaic plots use exact source geometry with distinct categorical response colours",
  "series": {
    "id": "biological-data-science-with-r",
    "title": "Biological Data Science with R",
    "url": "https://bdsr.stephenturner.us/",
    "order": 11,
    "chapter": "Essential statistics 8.3.2-8.7"
  }
}
