{
  "schema": 1,
  "kind": "lesson",
  "id": "oriclabs/bdsr-nhanes-regression",
  "name": "bdsr-nhanes-regression",
  "title": "Biological Data Science with R: NHANES Linear Regression",
  "summary": "Exact adult height-weight model with restored interpretation guidance and both source-matched regression figures generated by BioLang.",
  "publisher": "oriclabs",
  "version": "1.0.2",
  "status": "stable",
  "verified": false,
  "manifest": "https://raw.githubusercontent.com/oriclabs/biolang-lessons/main/lessons/biostatistics/bdsr-nhanes-regression/lesson.json",
  "manifestSha256": "7f9d77778b46763819e02178154ae32dcb31a17cc3a5451b6deb533d48b359a5",
  "publishedAt": "2026-09-04",
  "compatibility": {
    "biolang": ">=1.5.0",
    "studio": ">=0.1.0",
    "runtimes": [
      "browser",
      "desktop",
      "somer"
    ]
  },
  "categories": [
    "biostatistics",
    "epidemiology",
    "teaching",
    "visualization"
  ],
  "tags": [
    "biostatistics",
    "NHANES",
    "linear regression",
    "CC BY-NC"
  ],
  "discoverability": {
    "problems": [
      "model adult weight from height",
      "recognize unsafe model extrapolation"
    ],
    "methods": [
      "ordinary least squares",
      "complete-case analysis",
      "range-aware interpretation"
    ],
    "plots": [
      "height-weight regression with confidence band",
      "regression extrapolation plot"
    ],
    "terms": [
      "NHANES",
      "linear regression",
      "slope",
      "intercept",
      "R squared",
      "extrapolation"
    ],
    "aliases": [
      "BDSR linear model",
      "NHANES height weight",
      "adult weight regression"
    ],
    "functions": [
      "read_csv",
      "filter",
      "drop_null",
      "lm",
      "stats_relationship_plot"
    ]
  },
  "sourceRepository": "https://github.com/oriclabs/biolang-lessons",
  "licence": "CC BY-NC 4.0",
  "validation": "Exact official-data model coefficients, restored interpretation guidance, and two source-matched BioLang figures",
  "series": {
    "id": "biological-data-science-with-r",
    "title": "Biological Data Science with R",
    "url": "https://bdsr.stephenturner.us/",
    "order": 10,
    "chapter": "Essential statistics - simple linear regression"
  }
}
