{
  "schema": 1,
  "kind": "lesson",
  "id": "oriclabs/bdsr-nhanes-group-tests",
  "name": "bdsr-nhanes-group-tests",
  "title": "Biological Data Science with R: NHANES Group Comparisons",
  "summary": "All three source NHANES Welch tests, the smoking-status ANOVA and Tukey comparisons, restored Understanding guidance, and a source-matched BioLang boxplot.",
  "publisher": "oriclabs",
  "version": "1.1.0",
  "status": "stable",
  "verified": false,
  "manifest": "https://raw.githubusercontent.com/oriclabs/biolang-lessons/main/lessons/biostatistics/bdsr-nhanes-group-tests/lesson.json",
  "manifestSha256": "9716b55c44d5fb35c4110ae680091232bcd660fc178ee3f0431bc135ec1936b2",
  "publishedAt": "2026-09-04",
  "compatibility": {
    "biolang": ">=1.5.0",
    "studio": ">=0.1.0",
    "runtimes": [
      "browser",
      "desktop",
      "somer"
    ]
  },
  "categories": [
    "biostatistics",
    "epidemiology",
    "teaching",
    "visualization"
  ],
  "tags": [
    "biostatistics",
    "NHANES",
    "t-test",
    "ANOVA",
    "CC BY-NC"
  ],
  "discoverability": {
    "problems": [
      "compare adult age by gender",
      "compare BMI by diabetes",
      "compare alcohol use by relationship status",
      "compare BMI across smoking groups"
    ],
    "methods": [
      "Welch two-sample t-test",
      "one-way ANOVA",
      "Tukey HSD"
    ],
    "plots": [
      "BMI by smoking-status boxplot"
    ],
    "terms": [
      "NHANES",
      "group comparison",
      "Welch test",
      "paired and unpaired tests",
      "ANOVA",
      "multiple comparisons"
    ],
    "aliases": [
      "BDSR t test",
      "BDSR ANOVA",
      "NHANES smoking BMI"
    ],
    "functions": [
      "read_csv",
      "filter",
      "drop_null",
      "ttest",
      "anova",
      "tukey_hsd",
      "stats_group_plot"
    ]
  },
  "sourceRepository": "https://github.com/oriclabs/biolang-lessons",
  "licence": "CC BY-NC 4.0",
  "validation": "All three source Welch questions, exact ANOVA and Tukey results, and source-matched BioLang smoking-BMI boxplot",
  "series": {
    "id": "biological-data-science-with-r",
    "title": "Biological Data Science with R",
    "url": "https://bdsr.stephenturner.us/",
    "order": 9,
    "chapter": "Essential statistics - group comparisons"
  }
}
